id,username,password,favouriteMovies
0,trial,dummy,the dark knight;avengers: endgame;the hunger games;Zindagi na Milegi Dobara
1,trial2,dummy2,the dark knight rises;avengers: endgame;the hunger games
2,trial3,trial3,the dark knight;the dark knight rises;avengers: endgame;Zindagi na Milegi Dobara
3,vinayak,gupta,interstellar;the godfather;avengers: endgame;inception;zindagi na milegi dobara, Dhoom 2
4,dhakshit,1234,Avengers: endgame;aquaman;the batman;Spider-Man: No Way Home;Dhoom 2
5,testUsername,testPassword,Avengers: Endgame;Interstellar;Shutter island